{
  "config": {
    "latency": 0,
    "name": "Schlafzimmer",
    "stream": "pipe:///tmp/snapfifo",
    "volume": {
      "muted": false,
      "percent": 100
    }
  },
  "connected": false,
  "host": {
    "arch": "armv6l",
    "ip": "192.168.0.24",
    "mac": "80:1f:02:ed:fd:e0",
    "name": "wohnzimmer",
    "os": "Raspbian GNU/Linux 8.0 (jessie)"
  },
  "lastSeen": {
    "sec": 1464339375,
    "usec": 480894
  },
  "snapclient": {
    "name": "Snapclient",
    "protocolVersion": 2,
    "version": "0.7.0"
  }
}
